{
  "name": "collect_appointment_info",
  "version": "1.2.0",
  "metadata": {
    "title": "Collect Appointment Information",
    "description": "Collects and validates appointment details from user conversation during voice call. This function is typically the first step in the appointment booking flow, gathering essential information before checking availability and creating the booking.",
    "status": "implemented",
    "priority": "critical",
    "category": "booking",
    "tags": ["appointment", "collection", "validation", "retell"],
    "author": "AskPro Engineering Team",
    "lastModified": "2025-11-06T00:00:00Z"
  },
  "endpoint": {
    "method": "POST",
    "path": "/api/retell/collect-appointment-info",
    "baseUrl": "https://api.askpro.ai",
    "timeout": 15000,
    "retryable": false,
    "authentication": {
      "type": "bearer",
      "required": true
    }
  },
  "parameters": {
    "required": [
      {
        "name": "call_id",
        "type": "string",
        "format": "uuid",
        "description": "Unique identifier for the Retell call session. Used to track conversation state and link subsequent function calls.",
        "example": "call_abc123xyz456",
        "pattern": "^call_[a-zA-Z0-9]+$"
      },
      {
        "name": "service_name",
        "type": "string",
        "description": "Name of the requested service. Must match an active service in the system. Supports synonym matching (e.g., 'Haarschnitt' matches 'Herrenhaarschnitt').",
        "example": "Herrenhaarschnitt",
        "minLength": 2,
        "maxLength": 100
      },
      {
        "name": "customer_phone",
        "type": "string",
        "format": "phone",
        "description": "Customer's contact phone number in E.164 format. Used for identification and SMS notifications.",
        "example": "+4915123456789",
        "pattern": "^\\+\\d{10,15}$"
      }
    ],
    "optional": [
      {
        "name": "customer_name",
        "type": "string",
        "description": "Customer's full name. If not provided during this call, will be requested in follow-up conversation.",
        "example": "Max Mustermann",
        "minLength": 2,
        "maxLength": 255
      },
      {
        "name": "customer_email",
        "type": "string",
        "format": "email",
        "description": "Customer's email address for confirmation emails and appointment reminders.",
        "example": "max.mustermann@example.com",
        "maxLength": 255
      },
      {
        "name": "preferred_date",
        "type": "string",
        "format": "date",
        "description": "Preferred appointment date in YYYY-MM-DD format. Must be today or future date. Used for initial availability check.",
        "example": "2025-11-15",
        "pattern": "^\\d{4}-\\d{2}-\\d{2}$"
      },
      {
        "name": "preferred_time",
        "type": "string",
        "format": "time",
        "description": "Preferred appointment time in HH:MM format (24-hour). Used to narrow availability search.",
        "example": "14:30",
        "pattern": "^([01]\\d|2[0-3]):([0-5]\\d)$"
      },
      {
        "name": "notes",
        "type": "string",
        "description": "Additional notes or special requests from the customer. Stored with appointment for staff reference.",
        "example": "Bitte mit Föhnen und Styling",
        "maxLength": 1000
      },
      {
        "name": "branch_name",
        "type": "string",
        "description": "Preferred branch location if multi-branch company. If not specified, uses default branch.",
        "example": "Hauptfiliale München",
        "maxLength": 255
      }
    ]
  },
  "validation": {
    "rules": [
      {
        "field": "call_id",
        "rule": "required|string|regex:/^call_[a-zA-Z0-9]+$/",
        "message": "Call ID must be in format 'call_xxxxx'"
      },
      {
        "field": "service_name",
        "rule": "required|string|min:2|max:100",
        "message": "Service name is required and must be between 2 and 100 characters"
      },
      {
        "field": "customer_phone",
        "rule": "required|string|regex:/^\\+\\d{10,15}$/",
        "message": "Phone number must be in E.164 format (e.g., +4915123456789)"
      },
      {
        "field": "customer_email",
        "rule": "nullable|email|max:255",
        "message": "Email must be a valid email address"
      },
      {
        "field": "preferred_date",
        "rule": "nullable|date|after_or_equal:today",
        "message": "Preferred date must be today or in the future"
      },
      {
        "field": "preferred_time",
        "rule": "nullable|regex:/^([01]\\d|2[0-3]):([0-5]\\d)$/",
        "message": "Time must be in HH:MM format (e.g., 14:30)"
      },
      {
        "field": "notes",
        "rule": "nullable|string|max:1000",
        "message": "Notes cannot exceed 1000 characters"
      }
    ],
    "custom": [
      {
        "name": "ServiceExists",
        "description": "Validates that the service_name matches an active service in the database (including synonym matching)",
        "implementation": "app/Services/Retell/ServiceValidation.php"
      },
      {
        "name": "PhoneNumberUnique",
        "description": "Checks if phone number is already associated with a pending appointment for the same call session",
        "implementation": "app/Rules/UniquePhoneForCallSession.php"
      },
      {
        "name": "BranchAccessible",
        "description": "Validates that the specified branch belongs to the company and is accessible",
        "implementation": "app/Rules/BranchBelongsToCompany.php"
      }
    ]
  },
  "responses": {
    "success": {
      "statusCode": 200,
      "schema": {
        "type": "object",
        "required": ["success", "message", "data"],
        "properties": {
          "success": {
            "type": "boolean",
            "const": true
          },
          "message": {
            "type": "string"
          },
          "data": {
            "type": "object",
            "required": ["appointment_id", "status", "collected_fields", "missing_fields"],
            "properties": {
              "appointment_id": {
                "type": "string",
                "format": "uuid"
              },
              "status": {
                "type": "string",
                "enum": ["pending", "ready_for_booking"]
              },
              "collected_fields": {
                "type": "array",
                "items": {
                  "type": "string"
                }
              },
              "missing_fields": {
                "type": "array",
                "items": {
                  "type": "string"
                }
              },
              "service": {
                "type": "object",
                "properties": {
                  "id": {
                    "type": "string",
                    "format": "uuid"
                  },
                  "name": {
                    "type": "string"
                  },
                  "duration": {
                    "type": "integer"
                  },
                  "price": {
                    "type": "number"
                  }
                }
              }
            }
          }
        }
      },
      "example": {
        "success": true,
        "message": "Appointment information collected successfully",
        "data": {
          "appointment_id": "550e8400-e29b-41d4-a716-446655440000",
          "status": "ready_for_booking",
          "collected_fields": [
            "service_name",
            "customer_name",
            "customer_phone",
            "preferred_date",
            "preferred_time"
          ],
          "missing_fields": [],
          "service": {
            "id": "660e8400-e29b-41d4-a716-446655440001",
            "name": "Herrenhaarschnitt",
            "duration": 30,
            "price": 25.00
          }
        }
      }
    },
    "errors": [
      {
        "statusCode": 400,
        "type": "ValidationError",
        "description": "Request validation failed. One or more parameters are invalid or missing.",
        "schema": {
          "type": "object",
          "required": ["success", "message", "errors"],
          "properties": {
            "success": {
              "type": "boolean",
              "const": false
            },
            "message": {
              "type": "string"
            },
            "errors": {
              "type": "object",
              "additionalProperties": {
                "type": "array",
                "items": {
                  "type": "string"
                }
              }
            }
          }
        },
        "example": {
          "success": false,
          "message": "Validation failed",
          "errors": {
            "customer_phone": [
              "The phone number format is invalid"
            ],
            "preferred_date": [
              "The preferred date must be today or in the future"
            ]
          }
        }
      },
      {
        "statusCode": 404,
        "type": "ServiceNotFound",
        "description": "The requested service does not exist or is not active.",
        "schema": {
          "type": "object",
          "required": ["success", "message"],
          "properties": {
            "success": {
              "type": "boolean",
              "const": false
            },
            "message": {
              "type": "string"
            },
            "suggestion": {
              "type": "string",
              "description": "Suggested alternative service name"
            }
          }
        },
        "example": {
          "success": false,
          "message": "Service 'Haarschnit' not found",
          "suggestion": "Did you mean 'Haarschnitt'?"
        }
      },
      {
        "statusCode": 422,
        "type": "UnprocessableEntity",